marca,mencao,sentimento,data
Nike,"Nike Golf Shoes: muito, com a minha recente compra desses sapatos de golfe da Nike. Até agora, eles parecem estar se sustentando bem. Ainda não tive o curso com eles, mas atingiu o driving range e eles são definitivamente confortáveis. Recomendaria o preço.",positivo,2025-06-01
Nike,"Jimpster - Ciência Doméstica: Uma partida radical para Jamie Odell (também conhecida como Jimpster), a ciência doméstica leva mais de seu apelido de audiomontagem mais orientado para a dança. Isso não quer dizer que este álbum não seja bom; Pelo contrário, compartilha muito com outros mestres de dança, como o Atjazz. ""No fundo"", por exemplo, é o mais profundo possível e deve obter, enquanto ""estado de espírito"" é um bom downtempo Funker. ""Fish Island"" é uma casa profunda que de repente termina com um destro jazzístico, enquanto ""Knuckle Shuffle"" custa mais tecnologia. ""Groove Jumping"" é um funk perversamente divertido, com uma amostra vocal que você simplesmente não pode desistir; ""37.000 pés"" continua essa vibração. ""B: Mine"", no entanto, derruba as coisas com uma canção de ninar lenta. ""Pixel Grain"" tem uma urgência de tinkl, enquanto a faixa final, ""Fluorescent Blue"" tem um vocal questionável. No geral, porém, é um passo em uma nova direção, que Odell lida com graça e, como sempre, musicalidade superior.",positivo,2025-06-01
Nike,"Ótima bolsa: comprei esta bolsa para o meu filho de 5 anos para seus jogos de futebol. Sua bola se encaixa bem no bolso da bola de malha, mas ele joga com uma bola de tamanho infantil e é bem apertada. Não tenho certeza se isso encaixará bolas maiores (como as bolas de basquete da NBA). O tamanho é bom para esse equipamento de futebol, garrafas de água, lanches, etc. Prefiro isso de volta à bolsa Nike da minha filha (que minha esposa comprou em uma loja de varejo). Ele também vem com uma base (papelão?) Dentro da bolsa para manter o fundo (o Nike One não tem isso).",positivo,2025-06-01
Nike,"Ótimo pelo preço: tendo recebido um relógio Nike antes, eu esperava que meu marido gostasse deste também. Não há tantos sinos e assobios quanto o outro, mas é metade do preço!",positivo,2025-06-01
Nike,"O que aconteceu, Billy?: Uau, este não é o mod que eu conhecia e amava. O que aconteceu com os grandes sons dos EUA para o MOD? Esta é uma rocha de ritmo médio, na melhor das hipóteses. Apenas mais um esforço preguiçoso da parte de Billy Milano para evitar conseguir um emprego. Esta deve ser a ""Billy Milano Band"", não está sob o mod do apelido. A paródia da capa no MSG é um clássico total, porém !! Compre SOD !!",positivo,2025-06-01
Nike,"Nike Nano braçadeira para o sistema Nike +: A única coisa que eu não gosto é que ele não possui uma janela de plástico transparente para que você possa ver a tela de informações do iPod! É mais durável do que a braçadeira pós -mercado e também parece melhor, mas, no que diz respeito a usá -la, o mercado de reposição é muito melhor apenas porque você não precisa tirar o iPod da banda toda vez que precisar ver a tela. Acho que é por isso que o preço foi tão incrível.",positivo,2025-06-01
Nike,Lance Nike Watch: Meu marido realmente gosta de seu novo relógio! Ele está treinando para testes de segurança pública e diz que é útil quando está correndo.,positivo,2025-06-01
Nike,"Não para caminhar!: Eu pedi esses sapatos para o trabalho de várias críticas positivas que eu li sobre eles, no entanto, esses não são sapatos de caminhada! Eles fazem meus pés doerem apenas caminhando de e para o ponto de ônibus, que fica na rua. Eles não têm muito amortecimento, tiveram que comprar inserções, mas, ao fazê -los, torná -los extremamente apertados. O único recurso que eu gosto é o slide fácil. Não compre -os se você estiver andando muito para procurar o sapato certo. Até agora, a Nike Air Max provou os melhores resultados (para mim). Espero que essa revisão ajude.",positivo,2025-06-01
Nike,"Fácil de remover: este gabinete é fácil de remover dos seus sapatos. E não se afasta ou se distrai da corrida. Ótimo se você tiver sapatos diferentes, gostaria de usar o Nike Plus.",positivo,2025-06-01
Nike,"Este livro precisa ir na seção de ficção: comprei este livro Hook, Line and Sinker (e o filme) quando criança. Então eu cresci e aprendi que tudo o que você leu não é a verdade. Foi provado que o autor fabricou artefatos (eles até encontraram o artesão que fez com que alguns deles fossem pagos) .Um um livro, considerando a leitura deste livro ou ver o documentário de Laring, lê -las. Ele torce os fatos. Deixa de fora qualquer coisa que refuta remotamente suas teorias e, como mencionado, antes de fabricar 'evidências' onde não existia. Um buraco de bala em um crânio de bisonte de 40.000 anos? Quão ridículo é isso? Este livro é valioso, pois pode ser usado uma ferramenta de ensino para mostrar aos alunos que eles não deveriam acreditar em tudo o que leem. Todo ano em que algum 'cientista' anuncia que ele encontrou Atlantis. Por causa de Von Daniken, aprendi a não receber esses relatórios pelo valor nominal.",neutro,2025-06-01
Nike,"Inovação Intuitiva: Este livro tem tudo a ver com fácil acesso e inspiração. Dos líderes da Nike a outras marcas icônicas, gostei de poder aparecer e conferir uma certa história sobre uma marca em que eu estava interessado (Quiksilver neste caso) e ter exemplos da vida real de pessoas por aí em diferentes partes da América corporativa. A diversidade de marcas e idéias representadas foi fenomenal (você pode dizer leite para a LEGO?) E achei as histórias inspiradoras e motivadoras. Definitivamente, vale a pena manter o seu transporte por alguns meses e algumas leituras.",positivo,2025-06-01
Nike,"A luz não liga: comprei este relógio há alguns meses e já mostra alguns problemas, funcionou bem por algumas semanas, mas agora a luz de discagem não ligava. Suspeito que a bateria esteja funcionando, o que não é aceitável para um item novo. Não tenho nenhuma solução além de levá -la a uma loja para verificar. Não posso esconder que estou desapontado com a experiência da Nike.",positivo,2025-06-01
Nike,"Muito bom: Fiquei inicialmente desligado por uma descrição grosseira no início do livro, mas depois me vi cada vez mais atraído pela história e aos personagens. O protagonista trabalha como intermediário para uma consultoria de suprimentos, providenciando que os suprimentos da Nike sejam enviados da China para os EUA e lida com as queixas e preocupações dos fornecedores. Ele está noivo de uma noiva que é perfeita no papel, mas ele encontra a viúva de seu falecido amigo mais atraente ... e o vínculo entre eles está crescendo. Quando ele tem um susto de câncer, ele é forçado a reavaliar seu trabalho e amor, essa foi uma leitura muito interessante, bem escrita com personagens críveis e momentos engraçados. O susto do câncer não arrasta a história para baixo, mas chama o personagem principal de ação. Há uma boa mistura de introspecção e narrativa. Eu gostei disso muito mais do que ""O Livro de Joe"".",positivo,2025-06-01
Nike,"Hardcore genérico sem surpresas: quando os atletas e líderes de torcida na minha escola finalmente entraram em ""Punk"", era essa banda. Slickly embalado, pouco exigente e ""ultrajante"", eles encheram um certo nicho de hipness. Este álbum é particularmente óbvio. Pequena ameaça, isca de esquilo, etc., se arremessou com uma falta de atendimento juvenil, mas os DK pareciam reunir com cautela suas forças e ajustar suas guitarras genéricas a uma aproximação laboratorial de discordância. Mas muito rapidamente começou a parecer que meu cortador de grama cruzando um pedaço interminável de dentes -de -leão. ""Profissionalismo"" e punk não são mutuamente exclusivos. Mas as coisas que você não pode fingir são sinceridade, novas idéias e uma emoção infecciosa. Sem isso, todos os apelidos provocativos, sentimentos de MRR e acrobacias publicitárias no mundo não podem ajudá -lo.",neutro,2025-06-01
Nike,"O dimensionamento é pequeno: sou um 7-3/8-tenho uma tampa da Nike com esse tamanho e experimentei muitas tampas na loja de Baltimore Orioles em Camden Yards-eu sei que é do tamanho certo. O gráfico de dimensionamento para este item mostra grande como 7-3/8-mas nem se encaixa na minha cabeça. Parece uma boa tampa, e a política de retorno parece muito boa - então estou voltando para o próximo tamanho maior. Se houver problemas nesse final, talvez eu atualize esta revisão.",positivo,2025-06-01
Nike,"Todos os shows, não vão.: A palavra -chave no título é ""única"". Vou dar isso. Tenho certeza de que o conteúdo passa como ""arte"" e, nesse sentido, eu sei o que gosto; isso não é. A maioria dessas faixas leva uma eternidade para ir a qualquer lugar e soar como a Chip Davis & Co. acabou de descobrir sintetizadores e software de loop. A única faixa realmente ouvida é ""Zip-A-Dee-Doo-Dah"", que se estabelece rapidamente e pelo menos soa como a música que deveria ser. Mesmo, juntamente com a maioria dos outros, é um estudo em ""Ei, mãe, assista isso!"" Geração de efeitos sonoros indignos do apelido da Disney ou do Mannheim Steamroller. ""Quando você deseja uma estrela"" emaranhado com ""Twinkle, Twinkle Little Star"" - com nenhum realmente vindo à tona - faz fronteira com o insulto; Jiminy Cricket não ficaria feliz! A menos que você seja um fã de experimentos iniciais do Moog, passe este.",positivo,2025-06-01
Nike,"Beethoven: Sinfonia n. 8 / Brahms: Sinfonia n. 2: Nesta gravação de Ermitage, ouvimos uma gravação de 1958 com o maestro Hans Knappertsbush, que lidera o Munchner Philharmoniker. A primeira peça que ouvimos é a Sinfonia n de Ludwig Van Beerhoven. 8 e o segundo é Johannes Brahms Sinfonia Número 2. O livreto contém notas de música. No entanto, infelizmente estes eram apenas italianos. Ainda assim, esta é uma gravação muito boa. Recomendado. 4 de 5.",neutro,2025-06-01
Nike,"Camisa de exercícios muito confortável e bonita: tenho camisas semelhantes da Adidas, Nike, Russell e New Balance. Esta camisa está entre as melhores camisas que já possuíam. O tecido é bom - um pouco menos sentimento sintético do que a maioria dos outros, apesar de ser quase todo poliéster - e o corte é certo, sendo nem muito apertado nem muito solto.",positivo,2025-06-01
Nike,"Boa surpresa: Li muitos comentários antes de comprar este relógio. Uma coisa boa é que você pode substituir as baterias você mesmo. Muitos proprietários de relógios polares reclamam que, embora a Polar seja uma boa marca, isso não deixaria você substituir as baterias sem pagar dinheiro considerável por isso na loja polar. As pessoas reclamariam que as tiras da Nike não são boas, mas eu não tive nenhum problema com elas até agora (eu o uso há um mês). A alça de plástico parece ser frágil, onde se adapta à faixa elástica, mas acredito que, se você lidar com isso gentilmente, não terá um problema. O monitor de freqüência cardíaca está funcionando perfeitamente e passa por todas as máquinas polares na academia, o que é maravilhoso porque você não precisa usar o relógio, se não quiser.",positivo,2025-06-01
Nike,"Vale a pena investir: recentemente, usei uma nike dri-fit & genérico [...] luvas de treino. Os Nikes não forneceram nenhuma proteção real e as luvas BB foram executadas tão bem quanto custaram (US $ 8). Eu não tenho essas luvas há muito tempo, mas gosto delas. Eles são fáceis de remover, pois não têm tiras de pulso e oferecem muita proteção.pro+ ótima proteção+ boa qualidade-um pouco de preenchimento dificulta ligeiramente os pull-ups, mas nada com o qual você não pode lidar. Eu recomendaria isso a qualquer um dos meus amigos. ************* Eles ainda estão em ótima forma e fizeram maravilhas por proteger minha mão.",positivo,2025-06-01
